{
  "$schema": "../../schemas/stage-manifest.schema.json",
  "artifacts": [
    {
      "attributes": {
        "archive_format": "deterministic-tar-gzip-v1",
        "uncompressed_source_bytes": 996151568
      },
      "bytes": 18269359,
      "media_type": "application/gzip",
      "path": "raw/fin4-residual-snapshot.tar.gz",
      "record_count": 285,
      "role": "raw-snapshot",
      "sha256": "589f3b272fb970c9b995e6d9433dc3deec66241a2cf061be230254445704d9d0",
      "source_ids": [
        "stage60-local-snapshot"
      ]
    },
    {
      "bytes": 2683,
      "media_type": "application/json",
      "path": "summary.json",
      "role": "stage-summary",
      "sha256": "362c8b2a5d3424ed5e6181ca0842bf93e58591f2e66fdd6ae27ca23e8461cb1d",
      "source_ids": [
        "stage60-equation-index",
        "stage60-local-snapshot"
      ]
    },
    {
      "attributes": {
        "encoding": "o5rpair1-gzip-v1",
        "set_bits": 324157667,
        "uncompressed_bytes": 489598720,
        "uncompressed_sha256": "f3cce217528adee2305e618a81a1fdb7399c6732523bb60f055b1d5acf61f383"
      },
      "bytes": 7217176,
      "media_type": "application/gzip",
      "path": "normalized/324M_remaining_pairs.bitset.gz",
      "role": "pair-bitset",
      "sha256": "fdf831e78477f66074653427fb123b92655584577f405771dededbb1009ae7fc",
      "source_ids": [
        "stage60-local-snapshot"
      ]
    },
    {
      "attributes": {
        "encoding": "o5rpair1-gzip-v1",
        "set_bits": 284151591,
        "uncompressed_bytes": 489598720,
        "uncompressed_sha256": "03f4a7eccc7df811756fc5da361a647b49b9064f35b2b14730362fc3fb810756"
      },
      "bytes": 6243969,
      "media_type": "application/gzip",
      "path": "normalized/284M_remaining_pairs.bitset.gz",
      "role": "pair-bitset",
      "sha256": "108d72f3d36052cde34832bfc07ea8ea5a957d721e2e35d700e6f628e95198cb",
      "source_ids": [
        "stage60-local-snapshot"
      ]
    },
    {
      "bytes": 253171,
      "media_type": "text/csv+gzip",
      "path": "normalized/pair-partition-by-source.csv.gz",
      "record_count": 62576,
      "role": "pair-partition",
      "sha256": "53ff83710b96f3120ced63858255e097f11a145f3cf94bd2cff7a2639ddee287",
      "source_ids": [
        "stage60-equation-index",
        "stage60-local-snapshot"
      ]
    },
    {
      "bytes": 5761,
      "media_type": "text/csv+gzip",
      "path": "normalized/fin4-shards.csv.gz",
      "record_count": 256,
      "role": "fin4-shard-index",
      "sha256": "fe0aa5831fd9a72a4d3c6824dd67df262fcbbdae5c34b5a63d866c918ee3da9c",
      "source_ids": [
        "stage60-local-snapshot"
      ]
    }
  ],
  "captured_at": "2026-08-31T15:30:00+08:00",
  "claims": [
    "pairs.target",
    "pairs.fin4_covered",
    "pairs.residual"
  ],
  "depends_on": [
    "10-primary-9450"
  ],
  "notes": [
    "324,157,667 is the targeted universe after Fin2/3 coverage and singleton-true exclusions, not the full 3,915,693,200 directed nonreflexive universe.",
    "The normalized gzip mirrors make exact standard-library verification portable; their decompressed bytes equal the captured bitsets.",
    "Unavailable upstream seed inputs are listed in summary.json, so this stage is intentionally labeled frozen-artifact replay rather than from-scratch regeneration."
  ],
  "pipeline_order": 60,
  "schema_version": "1.0.0",
  "sources": [
    {
      "captured_at": "2026-08-31T15:30:00+08:00",
      "kind": "repository-snapshot",
      "license_status": "not-specified; no license grant inferred",
      "locator": "reproduction/10-primary-9450/raw/primary-recovery-snapshot.tar.gz#members/wubing/data/324M_remaining_pairs/order5_equations.csv",
      "notes": [
        "Committed evidence from an earlier reproduction stage."
      ],
      "source_id": "stage60-equation-index"
    },
    {
      "captured_at": "2026-08-31T15:30:00+08:00",
      "kind": "local-filesystem-snapshot",
      "license_status": "not-specified; no license grant inferred",
      "locator": "math-distill-equational-stage2: stable 324M/284M packages plus scalar and bit-sliced Fin4 shard records",
      "notes": [
        "The captured member tree was ignored by the source repository. The revision is context only; archive and member hashes identify the captured bytes."
      ],
      "revision": "6d8b449071a9168b3ddb35f77533e093833c70a4",
      "source_id": "stage60-local-snapshot"
    }
  ],
  "stage_id": "60-fin4-residual-284151591",
  "status": "verified",
  "title": "Fin4 residual pair universe: 324,157,667 - 40,006,076 = 284,151,591",
  "verification": {
    "checksum_file": "SHA256SUMS",
    "command": "python3 tools/verify_repository.py --stage 60-fin4-residual-284151591",
    "notes": [
      "Run python3 tools/rebuild_phase2.py first to regenerate Phase 2 normalized outputs from committed snapshots.",
      "Large bitsets are processed as bounded forward-only streams."
    ]
  }
}
